<!DOCTYPE FACULTY [
<!ELEMENT FACULTY (SPECIALITY, UNIVER, BALL, PEOPLE, CITY)>
<!ELEMENT SPECIALITY (#PCDATA)>
<!ELEMENT UNIVER (#PCDATA)>
<!ELEMENT BALL (#PCDATA)>
<!ELEMENT PEOPLE (#PCDATA)>
<!ELEMENT CITY (#PCDATA)>
]>